,title,text,date
116,"[궁금한 경제Y] 현대판 러다이트운동, 인공지능은 우리의...","· · · · 최근 chatGPT, DALL-E 등의 인공지능은 인간만의 고유 영역으로 여겨왔던 인문, 예술 부문에서 인간과 유사하거나 그보다 뛰어넘는 역량을 가질 수 있음을 보여주었어요. 인공지능 기술이 인간의 일들을 대신할 수 있다는 점에서 환영받고 있지만, 반대로 인간의 직업을 앗아갈...",2023.08.22.
117,"러시아, 인공지능 도입으로 IT 인력 부족 해결 계획",러시아 로스텔레콤은 인공지능을 도입해 IT 인력 부족 문제를 해결하겠다는 계획이다. 운영자는 소프트웨어 개발을 위한 자체 AI... 바로 사람 대신 인공 지능으로 대체하는 것이라고 Kommersant는 적고 있다. IT 직원을 알고리즘과 기술로 교체하려는 Rostelecom의 계획은...,2023.09.30.
118,소상공인을 위한 인공지능 챗GPT와 함께하는 식당 메뉴 구성...,"인공지능 챗GPT와 함께하는 식당 메뉴 구성 노하우 소상공인을 위한 인공지능 챗GPT와 함께하는 식당 메뉴 구성 및 가격 설정 노하우 안녕하세요, 소상공인 여러분! 오늘은 제가 인공지능 챗GPT와 함께 식당 메뉴 구성에 대해 이야기 나눈 내용을 유튜브 영상으로 만들어 보았습니다....",2023.10.10.
119,인공지능 챗봇 빙이 알려주는 군봉묵은지김치찜 대박 비결?,#인공지능빙 #군봉묵은지김치찜 안녕하세요. 맛집을 넘어 대박집을 소개하고 대박의 비결을 알려드리는 '인공지능 빅데이터 상권분석 온라인마케팅 전문가 김영갑교수'입니다. 인공지능 챗봇 빙이 알려주는 군봉묵은지김치찜 대박 비결? 인천 연수구 옥련동 맛집 군봉묵은지김치찜....,2023.09.04.
120,인공지능이 기자 대신한다? 알고 보니 '해프닝',인공지능(AI)도 기사를 쓸 수 있다는 소식에 많은 언론이 긴장했다. 미국 일간 뉴욕타임스(NYT)는 익명의 제보자 3명의 제보를 바탕으로... 인공지능 기술의 급격한 발전으로 다양한 업계에서 AI에 일자리를 뺏기진 않을까 우려하고 있다. 올해 4월 9일 비즈니스 인사이더는 AI가...,2023.07.21.
121,"AI 그림 그리기, Bing Image Creator로 인공지능 이미지...","Bing 이미지 생성기는 검색 사이트와 유사한 인터페이스로 누구나 쉽게 인공지능 이미지를 생성해 볼 수 있습니다. 추가로 생성한 AI 그림 ▲ 개인적으로 고양이를 좋아해 인공지능으로 다양하게 생성해 봤는데요. 프롬프트를 입력할 때 마지막에 수채화, 유화, 디지털 아트...",2023.04.08.
122,[최초를 넘어 최고로] 인공지능(AI) 스마트 교통관제 시스템...,보유하고 있는 혁신제품 중 ‘인공지능(AI) 스마트 교통관제 시스템’은 차량정보 영상을 수집하여 운전자와 보행자를 안전하게 인도하는 서비스로 혁신제품 뿐만 아니라 우수조달물품으로 지정되었다고 합니다. 조달청은 외 수출 조달 기업들을 지원하기 위해 앞으로도 수출...,2023.08.22.
123,한글 실력이 탁월한 인공지능 유튜브 요약 서비스 : 써머리...,"그런데 최근 생성형 인공지능 서비스들이 등장하면서 동영상 요약 서비스가 속속 등장하고 있다. 동영상에서 스크립트를 추출한 후 인공지능이 그 내용을 요약, 정리해준다. 워낙 많은 요약 서비스들이 등장하다보니 어떤 것을 활용할지 고민해야 할 정도다. 동영상 요약 서비스는...",2023.08.25.
124,대한민국 초거대 인공지능(AI) 도약 방안 발표,"대한민국 초거대 인공지능(AI) 도약 방안 발표 2023.09.13 과학기술정보통신부 과학기술정보통신부(장관 이종호, 이하 과기정통부)는 9월 13일(수) 오전 청와대 영빈관에서 ‘대한민국 초거대 인공지능 도약’ 행사를 개최 행사는 챗지피티에 대응한 국내 기업의 독자적...",2023.09.13.
125,"바이든 행정부, 인공지능 칩 중국에 수출 중단 계획 발표 후...","3% 하락 마감 - 바이든 행정부, 인공지능 칩 중국에 수출 중단 계획 발표 후 반도체 주가 하락 - Bank of America (BAC.N), 3분기 이익, 이자수익 예상치 상회, 약 2.1% 상승 EU Market Closing STOXX 600 ▼ 449.76 (-0.1%) DAX ▲ 15,251.69 (0.1%) FTSE 100 ▲ 7,675.21 (0.6%) CAC 40 ▲ 7,029.70...",2023.10.18.
126,"[광주cctv] 돌봄센터, 인공지능으로 아이들의 안전을 지킵니다.",방과 후 아이들을 안심하고 맡기실 수 있도록 안녕하세요 인공지능 경기cctv 광주cctv 전문 설치 자비스넷입니다. 여러분은 혹시... 광주cctv 이러한 이유로 아이들을 더욱 각종 상황에서 안전하게 보호할 수 있도록 광주시에 있는 다함께돌봄센터 지점에 cctv를...,2023.10.19.
127,우리나라에서도 인공지능 시스템을 만든다?,"오늘은 한국판 인공지능 시스템에 대한 소식을 들고 찾아왔습니다. 네이버에서는 2023년 2월 27일 데뷰(DEVIEW)에서 서치 GPT 프로젝트를... 네이버는 8월 24일 콘퍼런스 단(DAN) 23에서 생성형 인공지능(AI) 기반 검색 서비스 ‘큐(CUE):’를 공개하고, 변화하는 검색 서비스 청사진을...",2023.08.30.
128,Ai ETF (인공지능 관련주) 결국은 반도체 (국내 & 미국),최근 AI ETF인 글로벌엑스의 로보틱스&인공지능 ETF(BOTZ)나 로봇공학 및 자동화 관련 AI인 iSHARES의 IRBO 그리고 로봇 기술에 진심인 ROBT... AI 관련주는 결국 반도체 (엔비디아의 GPU 사례) 뭐 인공지능 관련주나 AI 관련주로 꼽히는 회사는 많습니다. OPEN AI (챗GPT 개발사)에...,2023.06.08.
129,"[오늘의 경제상식] 인공 지능 스타트업, 국가별 현황","예술가들이 비전을 실현할 수 있도록 돕는 DALL-E의 기능부터 주요 대도시의 전력 요구 사항을 자동화하는 것까지, 인공지능(AI)은... 2022년 인공지능 투자는 다양한 글로벌 부문으로 확산되었습니다: 헬스케어 무수히 많은 애플리케이션을 보유한 의료 부문은 전...",2023.09.22.
130,오디오크래프트 AudioCraft 출시(ft. 음악 제작 인공지능),여러 기업들이 인공지능(AI) 개발에 열을 올리고 있는 가운데 페이스북과 인스타그램을 운영하는 메타에서 오디오 크래프트(AudioCraft)... 오디오 크래프트는 텍스트를 입력하는 것만으로 음악을 만들 수 있으며 작곡과 작사도 할 수 있게 하는 모델입니다. 오픈...,2023.08.12.
131,인공지능 챗GPT 사용법 누구나 쉽게 숏폼 제작하기 강의후기,"챗GPT가 나온 후 인공지능에 대한 관심도 늘어났고, 활용할 수 있는 인공지능 서비스, 플랫폼도 정말 많이 나오고 있습니다. 생성형AI라 불리는 인공지능들을 이용해서는 글쓰기, 이미지 만들기, 동영상 만들기 등도 쉽게 할 수 있는데요. 블로그, 유튜브, 인스타그램 운영...",2023.08.23.
132,인공지능의 빈틈을 찾아라! AI 공격,여러분 인공지능 챗봇 '이루다'를 기억하시나요? 대한민국의 스타트업 스캐터랩에서 발표했던 이루다는 22살 여대생의 컨셉으로... 초기의 이루다 ⓒ 스캐터랩 https://luda.ai/ 이처럼 머신러닝을 위주로 하는 인공지능 기술은 여러 분야에서 다양하게 적용되고 있습니다....,2023.06.30.
133,AI 인공지능 개발자 취업 국비지원학원,인공지능 개발자 하는일 AI개발자 국비지원을 알아보기 전에 기본적으로 어떤 업무를 하는지를 알아야겠죠?!! 인공지능개발자 취업 직무는 AI 시스템 및 응용 프로그램의 설계 구축을 하고 배포를 하는 업무를 하게 됩니다. 요즘에 방대한 데이터가 많다보니 데이터분석과...,2023.07.26.
134,로봇 인공지능 관련주 BOTZ ETF 리얼리뷰,"요즘 로봇과 인공지능에 대한 투자자들의 관심이 뜨겁습니다. 이에 따라 로봇 관련 주식의 주가 흐름도 상당히 호조를 보이고... BOTZ 포트폴리오 BOTZ는 다양한 로봇 및 인공지능 기술에 투자하고 있는 기업들로 구성되어 있는데요. 미국을 비롯하여 일본, 스위스 등 다양한...",2023.06.22.
135,"인공지능 비메모리 반도체 관련주 엔비디아 주가 상승, 국내...",7개 종목 중에서도 특히 인공지능 관련주이자 비메모리 반도체 기업 엔비디아가 +2.95%로 가장 강세를 기록했다. 글로벌 시가총액 6위이자 반도체 기업 중 1위인 인공지능 관련주 엔비디아는 2위 TSMC와 2배 이상의 격차를 보이는 압도적인 기업이다. 반도체 분야는 크게...,2023.10.03.
136,인공지능 스터디 part2.,인공지능의 산출물에 대한 저작권 문제가 이미 대두되고 있으며 초기 방대한 데이터를 확보해 데이터에 대한 이슈 없이 이미 세팅을 끝낸 업체와 후발 주자의 격차는 클 수 밖에 없다. (5) 산업 벨류체인 1 - 파운데이션모델 - 대다수 하면 이 파운데이션 모델을 생각....,2023.09.15.
137,SK텔레콤 A.(에이닷) 공식출시 나만의 AI 개인비서 인공지능,"SK텔레콤 A.(에이닷) 공식출시 나만의 AI 개인비서 인공지능 안녕하세요. 사진&IT 크리에이터 자유분방입니다. SK텔레콤은 AI관련 기술... 그동안에도 인공지능 AI로서 실질적으로 일상에 도움이 되는 인공지능 기술들을 보여주기도 했지만, 지금까지는 '베타버전'이었습니다. 그리고...",2023.09.27.
138,인공지능으로 오래된 사진 화질 개선 _ Upscayl,"인공지능 기술을 활용하여 사진의 화질을 개선하는 UpScayl을 이용하여 범일동 1953년 철길옆을 지나는 사람들 사진의 화질을... #범일동 #Upscayl #인공지능 #화질 #개선 서양인이 그린 고종의 모습입니다. 왼쪽이 업스케일링한 이미지, 원본이 원본...",2023.10.11.
139,채혈측정부터 모바일 앱을 통한 사전감지까지 '인공지능을 통한...,"진단에서 예방, 그리고 인공장기까지 헬스케어 과학기술을 진일보 중입니다. 진단부터 예방을 이어 이제는 유관분야의 인공장기까지 인공지능에 기반한 헬스케어의 영역은 무궁무진합니다. 당뇨병에 이어 다른 성인병과 합병증도 헬스케어 과학기술이 해결할 수 있기를 희망합니다.",2023.08.08.
140,[수원cctv] 심플한 인테리어를 해치지 않는 카페 인공지능cctv,"컴팩트한 사이즈여도 인공지능 기능은 확실합니다. 안녕하세요 인공지능 경기cctv 수원cctv 설치 전문 자비스넷입니다. 현대인의 일상 중 일부분이 되어버린 카페, 대한민국엔 다양한 카페가 존재하는데요. 어느 공간이든 사람이 존재하고 물건이 존재하며 그로 인한 절도...",2023.10.09.
141,"앱개발, 인공지능, 증강현실, 핀테크 등 약 3만 건 수록","오늘은 핀테크기업, 인공지능기업, 앱개발업체, 어플리케이션개발과 관련된 정보를 담고 있는 2023 4차산업 기업·스타트업 주소록에... 게임 소프트웨어 개발 및 공급업부터 호스팅 및 관련 서비스업까지 총 21개의 업종별로 분류했기 때문에 핀테크기업, 기업...",2023.10.16.
142,서울 도시제조업 문제해결 인공지능(AI) 아이디어 경진대회...,안녕하세요 서울경제진흥원 SBA입니다 오늘은 서울 도시 제조업 문제해결 인공지능(AI) 아이디어 경진대회 참가자 모집 공고 소식을... 서울 도시제조업의 문제 해결을 위한 인공지능(AI) 아이디어 경진대회 ✅️ 공모분야 AI를 활용한 서울 도시제조업 문제해결 혁신 아이디어...,2023.09.26.
143,"인공지능 데이터라벨링, 내일배움카드 신청 가능한 크라우드웍스","인공지능 데이터라벨링, 내일배움카드 신청 가능한 크라우드웍스 안녕하세요. 사진&IT 크리에이터 자유분방입니다. 요즘은 뉴스를 보다 보면 인공지능 로봇이 아르바이트를 몇 명을 대체했다는 등의 뉴스가 나오게 됩니다. AI 은 일하기 편하게 하기 위해서 만들어지는...",2023.05.30.
144,인공지능 프로그래밍을 위한 코드 위스퍼러 비주얼 스튜디오...,바로 인공지능 AI 기반으로 코딩툴의 등장입니다. 마이크로소프트의 코 파일럿은 매달 10달러를 내야 하지만 아마존의 코드 위스퍼러의 경우 무료로 사용할 수 있습니다. 인공지능 프로그래밍 툴 코드 위스퍼러 설치 마이크로소프트 코 파일럿의 경우 비주얼...,2023.07.31.
145,"신개념의 맛집 검색 방법, 인공지능 빙으로 맛집 검색하기",#인공지능맛집검색 #빙으로맛집검색 #신개념맛집찾기 안녕하세요. 인공지능과 빅데이터를 이용해서 상권분석과 온라인마케팅을 알려드리는 김영갑 교수입니다. 오늘은 인공지능 챗봇 마이크로소프트 빙을 이용해서 맛집을 검색하는 다양한 사례를 설명드리도록 하겠습니다. 맛집...,2023.09.02.
146,"파파코 인공지능 AI 투자해 보고, 출석체크로 앱테크까지!","최근 인공지능 기반 AI 투자 플랫폼들이 많이 생겨나고 있는데요. 파파코에서는 투자뿐만 아니라 출석 체크를 통한 포인트 지급... 파파코는 인공지능 AI로 개발된 트레이딩 프로그램인데요. 요즘 챗 GPT나 AI, 로봇 기술에 대한 개발이 엄청나게 진행되고 있죠. 세상에 나와있는...",2023.10.06.
147,[Specialized Info] 인공지능과 의료기기,질병 진단 인공지능 개발 '붐' 인공지능(AI)이 4차 산업혁명의 핵심으로 부상한 가운데 바이오헬스 분야에서도 AI를 접목한 서비스를 개발하기 위해 국내외 많은 회사와 연구진들이 나서고 있습니다. 특히 우리나라는 탄탄한 정보통신기술(ICT) 인프라와 단일건강보험체제로...,2023.08.03.
148,제조업 분야에서 인공지능이 영향을 미칠 영향,"하나인 인공지능(AI)에 초점을 맞추고 있습니다. 아직 정확한 범위는 알려지지 않았지만 AI가 노동 시장에 상당한 영향을 미칠 가능성이 있다는 것은 더 이상 비밀이 아닙니다. OECD 보고서에 따르면, 인공지능은 ""범용 기술""이기 때문에, 거의 모든 분야와 직업이 영향을...",2023.07.26.
149,뤼튼 사용법 4 - 자주 쓰는 문구 저장하기 / 인공지능 강의,"뉴미디어캠퍼스에선 뤼튼, 챗gpt와 같은 인공지능 플랫폼을 활용한 SNS 콘텐츠 제작 강의를 진행하고 있습니다. 자세한 인공지능 강의 문의와 SNS 마케팅 강사 소개는 포스팅 하단 링크를 참고해주세요! 지난 뤼튼 사용법 3에선 pdf 파일을 업로드 해서 분석하는 법에 대해...",2023.08.04.
150,"[부천cctv] 더욱 선명한 음식점 보안, 인공지능 400만 화소로","인공지능으로 더욱 똑똑하게 400만 화소로 더욱 선명하게 안녕하세요 경기cctv 부천cctv 설치 전문 업체 자비스넷입니다. 음식점을... 그 중 하나인 보안 역시 챙기는 방법은 여러가지가 있는데요, 요즘은 자가설치부터 인공지능cctv까지 여러가지 선택의 폭으로 넓어졌습니다....",2023.10.06.
151,"미국 교육시장, 인공지능(AI)과 만나다","해외는 지금 신산업으로의 인공지능(AI) 교육산업… 혁신과 기회의 지평을 열다 메타버스(Metaverse), 공간의 의미를 새롭게 해석하다... 그리고 이는 전 세계 산업 전반에 큰 영향을 미치고 있는데 교육산업도 예외는 아니며, (AI)과 교육의 결합을 통해 새로운...",2023.07.29.
152,구글 AI 인공지능 챗봇 바드 사용법,챗gpt를 선두로 마이크로소프트에 이어 구글까지 ai 인공지능 챗봇 바드를 발표했습니다. 그래서 제가 사용법을 간략하게 알려드리려고... 다만 다른 챗봇과 마찬가지로 구글 AI 인공지능 바드 역시 이미지를 따로 보여주지는 않습니다. Bard의 최대 장점이라고 볼 수 있는 부분은...,2023.06.06.
153,"[용인cctv] 대형 비닐하우스, 화훼 매장에 인공지능을 적용하면?","안녕하세요 인공지능 경기cctv 용인cctv 설치 전문 자비스넷입니다. 식집사라는 말, 들어보셨나요? 반려식물을 키우는 분들에게 붙여진... 농장cctv 이러한 고민을 가지신 경기도 용인시 내 대형 화훼 비닐하우스엔 이런 부분을 해결하기 위한 cctv 설치를 진행하였습니다....",2023.10.10.
154,인공지능의 활용 1,"기업들은 여기저기서 챗봇 (인공지능 대화 시스템) 을 사용합니다. 외부 시스템을 쓰는 경우도 있고, 대기업의 경우 자체적으로 구축하기도 합니다. https://www.hitech.co.kr/news/articleView.html?idxno=21273 최근들어 본의아니게 포스코, 그중에서도 광양제철소에 관심을 많이...",2023.10.11.
155,우주항공과 인공지능에 관심있는 학생들 주목!...,국립중앙과학관에서는 초등 4학년 ~ 6학년 또는 동일 연령(11세 ~ 13세) 청소년을 대상으로 인공지능과 우주항공을 주제로 한 여름방학... 4(금) 10:00 2023년 캠프 주제는 <새로운 우주를 누리다 “우주 누리” / 인공지능 + 우주항공>입니다. 캠프에서는 우주항공 관련 전시관...,2023.07.18.
156,인공지능 AI,전세계적으로 인공지능 열품이 대단합니다. 마치 스마트폰이 처음 등장했을 때의 열기입니다. ChatGPT... 인공지능 AI Artificial Intelligence 블핑 제니 사진 편집하시려면 https://clipdrop.co/ 문서 작업은.....Notion...,2023.09.01.
157,인공지능과 함께라면 난도 디자이너! AI 디자이너 양성과정...,"인공지능 활용 기술은 갈수록 더 중요해지고 있어요 할 줄 아느냐 모르냐는 큰 차이인거 아시죠? 인공지능 실력, 정말 놀랄만큼 출중하다구요! 인공지능을 활용기술 습득해 필요한 그림도, 디자인도, 사진도 얻어가세요! AI 디자이너 양성과정 수강생 모집!...",2023.08.14.
158,"지능을 가진 존재가 지켜야 할 약속, 인공지능 윤리",점차 커져가는 인공지능 윤리에 대한 관심 인공지능이 나날이 발전하고 있습니다. 얼마 전까지 인공지능이라고 하면 사람보다 뛰어난 연산능력으로 복잡한 계산을 처리하는 도구로 생각하였습니다. 최근 ChatGPT와 같은 생성형 AI (Generative AI)는 기존의 복잡한 처리능력을...,2023.06.29.
159,"인공지능의 급성장, 급격한 인구감소","글로벌 출산율 저하, 인구감소를 250년전 산업혁명 시기 이후의 인구급증과 대비해서 인공지능 시대의 전환점으로 파악하는게 흥미롭다. 향후 글로벌 경제가 처할 상황은 출산율 저하로 청년층 감소, 노령화 가속으로 인한 부양의 부담이 가중되는 상황을 어떻게...",2023.06.05.
160,[인문학 강의] 인공지능과 미래인문학_'ChatGPT를 활용한...,"충청남도교육청교육연수원(공주시 소재)에서 인공지능과 미래인문학 과정 중 5급 이하 공무원 약 40명을 대상으로 'ChatGPT를 활용한 보고서 작성'에 관한 주제로 강의했습니다. 강의에서는 [인공지능 ChatGPT를 활용해 업무의 효율성을 높이는 방안]으로 보고서, 이메일, 보도자료...",2023.08.20.
161,"인공지능 챗GPT, 빙, 바드, 뤼튼, 클로바X 이용한 소상공인...","소상공인을 위한 블로그 글쓰기 특강 인공지능 챗GPT, 빙, 바드, 뤼튼, 클로바X 중심으로 인공지능을 활용한 블로그 글쓰기는 소상공인에게 시간을 절약하게 도와주고 품질 높은 콘텐츠를 생산하는 좋은 방법입니다. 인공지능으로 생성된 기본 내용을 수정하고 맞춤화하여 브랜드...",2023.08.25.
162,2027년 AI 인공지능 반도체 시장 매출 전망은?,오늘은 '2027년 AI 인공지능 반도체 시장 매출 전망은?' 에 대하여 알아보도록 하겠습니다. 전 세계 인공지능(AI) 반도체 매출이 앞으로 5년간 두 자릿수 이상의 성장률을 지속하며 2배 이상 커질 것이란 분석이 나왔습니다. AI 반도체 시장은 생성형 AI의 발전과 데이터...,2023.08.25.
163,대한민국 초거대 AI 도약… 인공지능을 전 국민 일상 속으로,"생성형 인공지능(AI) '챗GPT'는 23년 상반기 과학기술계의 최대 화두 중 하나였습니다. 이에 정부는 24년도 예산 9090억 원을 투입, 복지... 인공지능을 전 국민 일상 속으로 2024년 9090억 원 투입 2023년 상반기 과학기술계의 최대 화두 중 하나는 미국의 오픈AI가 개발한 생성형...",2023.09.21.
164,AI 인공지능 IoT 삼성 스마트싱스 SmartThings 연결하고...,"삼성 큐브 공기청정기 센서, 네트워크, AI 인공지능 기술을 통해 집안의 가전, 조명, 에너지 관리, 보안까지 제어하여 사용자의 편의성을... 스마트홈으로 구축하는 것을 뛰어넘어 이젠 AI 인공지능으로 더욱 똑똑해진 기능들을 살펴보았어요. 지금 삼성닷컴 홈페이지에 들어가시면...",2023.07.26.
165,반도체 종목 SK하이닉스 주가변동 인공지능 AI 5세대...,SK하이닉스 | 인공지능 AI 5세대 HBM메모리 2차전지 | 전기차 돈버는투자공부 홈카페 라떼아트 안녕하세요 초보주식투자자입니다... SK하이닉스가 인공지능 AI용 5세대 메모리 HBM3E를 개발에 성공하고 엔비디아에 샘플을 공급해 테스트를 거친 후 내년 상반기부터 양산에...,2023.08.22.
166,"인공지능의 진짜 성공이 의미하는 것 (ft. 테슬라, 일론 머스크)","일론 머스크는 이미 2013년부터 인공지능에 관심이 많아 구글의 래리 페이지, 리드 호프먼 허사비스 등과 열띤 토론을 했죠. 페이팔 마피아와 버락 오바마 대통령과도 만나며 인공지능의 위험성과 규제에 대해 알리기도 했습니다. 2015년에는 ChatGPT를 만든 샘 올트먼을 만나...",2023.09.22.
167,[주식분석] 엔비디아 제친 차세대 인공지능 반도체 주식 종목분석,이번 시간에 알아볼 내용은 한동안 인기를 끌었던 엔비디아의 뒤를 이을 차세대 인공지능 반도체 주식에 대한 분석입니다. 반도체 종목을 찾는 사람이라면 엔비디아를 못 들어본 분들은 없습니다. 올해가 시작하면서부터 시작된 챗gpt와 열풍은 엔비디아의...,2023.06.21.
168,파파코 인공지능 AI 투자 플랫폼 미국 지수 ETF 투자 후기,파파코는 자체 개발한 인공지능(AI) 기반의 100% 자동화 펀딩 플랫폼인데요. 2016년부터 2020년까지 약 5년 동안 개발 및 테스트를 거쳤다고 합니다. 처음에는 기업용 인공지능 트레이딩 프로그램을 목표로 하였지만 여의치 않았다고 하는데요. 결국 2020년 6월 15일 법인 설립 및...,2023.10.05.
169,바드 구글 인공지능 얼마나 똑똑할까? 바드 사용법,"얼리어답터 리뷰/IT정보 바드 구글 인공지능 얼마나 똑똑할까? 바드 사용법 by 엔돌슨 2023. 5. 2. 바드 구글 인공지능 얼마나 똑똑할까? 구글에서 만든 인공지능 아시나요? OpenAPI의 챗GPT가 큰 인기를 끌고 있지만, 인공지능의 원조는 테크 1위 기업인 구글이 아닐까...",2023.05.02.
170,"포토샵 2024, 생성형 채우기로 인공지능 경험하기","이번 어도비의 전폭적인 업데이트를 통해 디자인 툴과 인공지능이 절묘하게 결합되었습니다. 지난번에는 일러스트레이터에서 인공지능을 경험해 보았는데, 오늘은 포토샵에서 AI의 능력을 살펴 보겠습니다. 어도비 포토샵 2024에서는 생성형 채우기와 생성형 확장을 통해 작업자가...",2023.10.17.
171,어플리케이션제작 최신 인공지능을 이용하여 경쟁력 갖추는 방법,최신 인공지능을 이용한 어플리케이션 제작 방식은 모든 코딩을 인공지능이 대신해주게 되면서 어플리케이션을 제작하는데 코딩 개발자들이 없이 가능해졌습니다. 인공지능 어플리케이션 제작 방식은 종래의 코딩 위주의 개발 방식에서 벗어나 만들고자 하는 페이지를 계획하고...,2023.06.27.
172,"[양주cctv] 니트회사 물류창고, 화재 관리까지 인공지능으로?","인공지능cctv의 세계는 무궁무진합니다. 안녕하세요. 화재cctv 경기cctv 양주cctv 설치 전문 자비스넷입니다. 365일, 화재의 위험은 우리... 모든 현장 상황은 기본 cctv처럼 인공지능 영상분석을 곁들여 침입 등에도 감지를 하면서 만약 지정된 이상수치 이상으로 실내 환경의...",2023.09.29.
173,[수원cctv] 철공소에 화재 감지가 되는 인공지능cctv를...,"자비스넷은 연기감지카메라를 보유한 유일한 인공지능 보안 업체로 많은 고객님들께서 화재 관련 보안 문의를 주시곤 합니다. 이러한... 보통 화재 감지를 하는 인공지능cctv를 떠올리신다면 열화상카메라를 떠올리시는데, 이 열화상카메라를 포함해 기존 화재 감지기와...",2023.10.04.
