,title,text,date
174,[생활문화] AI 인공지능을 활용한 블로그 운영,"""AI 인공지능을 활용한 블로그 운영"" 과정에 대해 알아볼게요^^ 어떤 내용을 배우나요? 서초여성인력개발센터 블로그 운영 주제에 관한 인공지능 활용, 계정 설정 및 레이아웃 꾸미기 , 인공지능 서비스 가입 및 활용, 블로그 분석 내용 기반 콘텐츠 생산 연습, 해외 콘텐츠 활용...",2023.09.05.
175,뚜봇아 가정 양육수당 알려줄래 이벤트 안내::인공지능...,대구시 인공지능(ai) 민원상담사 뚜봇! 뚜봇아~ 가정 양육수당 알려줄래? 이벤트 에 대해 대구북구에서 알려드립니다! 자세한 내용은 아래의 게시물을 참고해주세요❗ 뚜봇아~ 가정 양육수당 알려줄래? ✅이벤트 기간 9. 11.(월) ~ 9. 22.(금) ✅당첨자 발표 9. 27.(수) 뚜봇...,2023.09.12.
176,2023 월드IT쇼 SK텔레콤 AI 인공지능 기술과 UAM,"인공지능 스피커로도 괜찮을 것 같네요. A.(에이닷)은 대화형 인공지능 서비스를 지원하는 개인 맞춤형 AI 에이전트입니다. 전용 앱을 통해서는 사용자의 취향에 맞춘 사진 보정, KBO 프로야구 중계, 게임, FLO 음악 추천 등을 즐겨볼 수 있는데요. 최근 업데이트를 통해...",2023.04.28.
177,인공지능 스터디 part1.,(1) 인공지능 why? 고성장이 보이는 섹터 대한민국이 여러가지로 유리한 포지션을 갖춘 산업 투자뿐 아니라 개개인의 삶에서도 반드시... 인공지능이 인터넷 만큼의 성장이 나올지는 솔직히 모르겠습니다. 허나 확실한 건 아직 초기 시장이며 을 사용자들이 앞으로 매년...,2023.09.14.
178,"‘이미지 생성 1타 인공지능‘ 미드저니, 기본 가이드","최근 인공지능 이미지 생성 서비스인 '미드저니(Midjourney)가 사용자 수 1000만명을 돌파했다. 지난 7월에 서비스를 시작해, 11월에 300만명을... 프로필 이미지에 특화된 인공지능, 일본 2D 애니메이션 스타일에 특화된 등 AI 이미지 생성 시장이 갈수록 분화되는 양상을...",2023.02.16.
179,생성형 인공지능 누가누가 잘하나?-GenAI 50,"CB Insights는 8월 8일 전 세계에서 가장 유망한 민간 생성형 인공지능(GenAI) 50개 기업 GenAI 50 수상기업을 발표했다. 2023년 수상 기업 중 16개는 미디어, 엔터테인먼트 캐릭터 애니메이션, 의료 분야 약물 발견 등 산업별 GenAI 사용 사례에 중점을 두고 있다. 20개...",2023.08.11.
180,"인공지능 데이터라벨링, 남녀노소 가능해 (feat. 무료교육...","먼저 이 일에 대해 잘 모르는 분들이 많으실 것 같아 간단히 설명드리자면, 인공지능이 어떠한 데이터를 학습할 수 있도록 그에 맞는... 굉장히 많은 것들이 인공지능화 되어가고 있어요. 그만큼 어떻게 보면 사람이 할 일을 AI가 대신한다고 볼 수 있지만, AI가 사람에 준하는 일을...",2023.10.15.
181,"오산시, 운암뜰 인공지능(AI)시티 도시개발사업 토지주 면담",‘운암뜰 인공지능(AI)시티 도시개발’사업 토지주들과 면담을 가졌습니다. 이날 면담에는 토지주 10여 명이 방문한 가운데 시청 도시개발과 관계자도 참석했는데요. ‘운암뜰 인공지능(AI)시티 도시개발’사업은 오산동 166번지 일원의 약 58만여 제곱미터 면적에 동탄 트램 연결...,2023.08.18.
182,AMD 그래픽카드 스테이블 디퓨전으로 인공지능 사진 만든 소감,"얼마 전 그래픽카드 구매를 할 때, 인공지능 그림 돌리려고 AMD에서 엔비디아로 바꾼다는 글이 몇 개 보이길래 뭔가 했더니~ 스테이블 디퓨전(Stable Diffusion) 일명 webui가 엔비디아 그래픽카드에서 잘 돌아가는 것이었군요. 이웃이신 서타이거 님께서 만드신 ...",2023.05.03.
183,현재 주가조작이 의심되는 종목을 인공지능 바드(Bard)에...,"현재 실험 버전으로 제공되고 있는 구글의 인공지능 서비스 '바드(Bard)'에 ""현재 한국 주식시장에서 주가조작이 진행되고 있는 듯한 종목이... 챗GPT, 바드 같은 인공지능이 놀라움도 주기는 하지만 아직은 정확도 측면에서 가야 할 길은 많이 남은 것 같기는 해 보입니다. 대신 정답이...",2023.06.05.
184,인공지능 AI 골드러쉬 (ft. 닷컴버블 vs 인터넷 붐),"* Wedbush 분석가 Dan Ives에 따르면 주식 시장에서 ""인공지능 AI 골드 러시""가 막 시작되고 있습니다. * 현재의 주식 시장은 닷컴 버블이 터지던 1999년보다 1995년과 더 비슷해 보인다고 말했습니다. * 아이브스는 ""인공지능 혁명이 이제 막 시작되고 있다""고 말했습니다....",2023.07.30.
185,"가온그룹 주가 전망 및 실적 분석 (ft. 로봇, 인공지능 관련주)","로봇, 인공지능 관련주) 안녕하세요. 머니알람입니다. 이번 포스팅에서는 로봇, 인공지능 관련주 중 하나인 가온그룹에 대해서 다뤄보려고 합니다. 가온그룹 주가 전망 및 실적 분석까지 알아보도록 하겠습니다. 먼저 어떤 기업인지 살펴볼까요? 가온그룹은 어떤 기업일까?...",2023.10.03.
186,"새로워진 인공지능 비서 SKT A.(에이닷), 이젠 챗GPT 기능까지","새로워진 인공지능 비서 SKT A.(에이닷), 이젠 챗GPT 기능까지 안녕하세요. 사진&IT 크리에이터 자유분방입니다. SKT의 인공지능 AI 서비스인 A.(에이닷)이 6월 30일 '내 손안의 AI 친구'라는 새로운 슬로건을 기반으로 업데이트되었습니다. 기존에도 영리했던 A.(에이닷)에 어떤...",2023.07.21.
187,"[기회기자단] 경기도, 인공지능 활용해 모두를 위한 예술혁명 실현","6월 12일(월)까지 14일간 열리는 이번 전시회는 경기도와 경기도문화재단이 사전 모집한 예술에 관심이 있는 발달장애인들에게 생성형 인공지능(AI)을 활용해 예술 활동 교육을 하고, 예술가와 협업해 완성한 작품 30점을 전시하는 것입니다. 이번 전시는 을 활용해...",2023.05.31.
188,자율주행과 인공지능 그리고 학습방법,"언어 간 번역에서 신약 설계에 이르기까지 모든 종류의 데이터를 처리하고 모든 작업을 수행할 수 있는 단일 AI 모델 아이디어는 인공 일반 지능(AGI)으로 알려져 있습니다. 어떤 사람들에게는 그것이 모든 인공지능 연구의 궁극적인 목표이고, 다른 사람들에게는 그것이 우리가...",2023.08.09.
189,강사양성 과정] 성공하는 소상공인을 만드는 인공지능 활용법,#김영갑교수 #강사양성과정 #인공지능활용 안녕하세요. 소상공인을 위한 인공지능 활용 전문가 김영갑 교수입니다. 소상공인을 위한 중장년 디지털 강사양성 과정 성공하는 소상공인을 만드는 인공지능 활용법 인공지능 빅데이터 활용 상권분석 온라인마케팅 전문가 김영갑교수...,2023.09.14.
190,"인공지능 챗 chat GPT 의 플러그인, 브라우징 활용법","얼리어답터 리뷰/IT정보 인공지능 챗 chat GPT 의 플러그인, 브라우징 활용법 by 엔돌슨 2023. 5. 23. 인공지능 챗 chat GPT 의 플러그인, 브라우징 활용법 챗GPT 안에서 모든 걸 해결할 수 있게 됩니다. 이제는 호텔 예약, 비행기 예약, 배달 주문, 주식 정보, 날씨 정보 등을...",2023.05.23.
191,인공지능 머신러닝 책 추천-파이썬 3학년 머신러닝의 구조,"♣ 인공지능 머신러닝 책 추천-파이썬 3학년 머신러닝의 구조 선형 회귀, 서포트 벡터 머신, 랜덤 포레스트... 머신러닝을 위해 필수로 익혀야하는 이 개념들을 초등학생도 이해할 수 있게 쉽게 풀이한 책이 있어 소개합니다. 저도 파이썬을 열심히 공부한 초등학생들에게 ...",2023.10.13.
192,"인공지능 속도에 밀려나는 ‘AI 윤리’, 특이점 올까","인공지능은 기본적으로 인간의 지능을 모방하는 기술로, 다양한 분야에서 유용하게 활용되지만 실제로 써 보면 항상 긍정적인 결과를 낳는 것은 아니다. 편리와 효율을 강조하다보니 오히려 인간의 권리나 가치를 침해하거나, 편향과 차별을 야기하거나, 부정적인 목적으로...",2023.03.31.
193,AICE 인공지능 인기 자격증 BASIC 코스,AICE 인공지능 인기 자격증 BASIC 코스 최근 AICE라고 불리는 인공지능 자격증이 인기이다. 대기업 재직자들이 인공지능 자격증 취득을 위해 힘을 쓰고 있다고 한다. AICE 자격증에 대해 알아보도록 하자. AICE 자격증 BASIC 코스 AICE는 AI Certificate for Everyone의 약자로...,2023.07.05.
194,"[이천cctv] 야외 농장, 까다로운 보안을 풀컬러 인공지능...",주변이 어두워도 문제 없는 보안카메라 안녕하세요 인공지능 경기cctv 이천cctv 설치 전문 자비스넷입니다. 자비스넷에선 여러가지... 자비스넷이 제일 중요하게 여기는 것은 신속하고 편리한 보안으로 이러한 화재를 비롯해 카메라에 침입 현황이 보일 시 영상분석...,2023.10.12.
195,"[경제/사회] 구글 인공지능 채팅 gpt, BARD 후기","오늘은 구글 인공지능 채팅을 해봤는데요. 한 번 소개해보려 해요. 이렇게 구글에 BARD를 검색하면 바로 나와요. 프롬포트 입력하는 곳에... © markusspiske, 출처 Unsplash 이러한 BARD라는 인공지능 채팅에서 얻을 수 있는 정보는 정말 빠르고 쉽게 얻을 수 있어요. 다만, 이 글에 대한...",2023.06.08.
196,미국펀드투자 자동매매도 AI인공지능펀드로 해보기,"파파코로 미국펀드투자 자동매매 해보기 주식시장에서도 비약적으로 인공지능 기술이 발전하면서, 손 하나 까딱 안 하고 주식을... 인공지능 주식투자 플랫폼 [ 파파코 ] 오늘 소개해 드릴 인공지능 주식투자 플랫폼 [파파코]역시, 자동으로 펀딩을 해서, 레버리지와 인버스에...",2023.09.15.
197,광주인공지능사관학교 4기 교육생 2차 모집 중!,세계로 도약하는 No.1 AI 핵심인재양성의 산실 광주인공지능사관학교에서 4기 교생을 모집합니다! [ 모집기간 ] 2023.03.01.(수) ~ 03.31.... 광주인공지능사관학교 홈페이지 신청 https://gj-aischool.or.kr/ [ 문 의 ] 운영사무국 062)710-3257~9 2020년 개교한...,2023.03.09.
198,10초 만에 답을 알려주는 인공지능? 챗GPT!,"한국 IDC에 따르면 국내 인공지능 시장은 전반적인 성장세를 보이고 있습니다. 그 중, 최근 높은 관심을 받고 있는 챗GPT를 아시나요? 챗GPT란 대화형 인공지능으로 현재 대화형 인공지능 분야에서 가장 발전된 기술 중 하나인 오픈AI의 GPT-3.5로 학습된 대규모 언어 모델입니다....",2023.05.04.
199,제품 촬영도 이젠 인공지능 시대 AI 마케팅 현재 무료 서비스,요즘 인공지능이 다양한 분야에서 활동하는데요. 앞으로 우리가 살아갈 사회 여러 분야에서 인공지능이 어디까지 발전할지 궁금해져 갑니다. 오늘은 제품 촬영한 이미지를 인공지능을 통해 다양한 이미지로 만드는 사이트를 소개해 드리겠습니다. 제품의 배경을 멋집 이미지로...,2023.08.07.
200,우리나라 교육과정을 알고 있는 토종 생성형 인공지능...,하이퍼클로바 엑스가 한글 데이터에 기반을 둔 인공지능 서비스이다. 교사 입장에서 제일 먼저 확인해 보고 싶은 것은 우리나라... 하지만 챗GPT나 다른 외국 생성형 인공지능 서비스들이 활용하는 데이터에는 우리나라 교육과정이 반영되지 않고 있다. 교육과정에 대한 질문을 하면...,2023.08.26.
201,인공지능- 음악을 작곡하는 AI도구,"인공지능 - 음악을 작곡하는 AI도구 [생성형 음악 제작 도구] 1. AudioCraft 2. OpenAI Jukebox 와 MuseNet 3. Amper Music 4. Soundful 5. AIVA (Artificial Intelligence Virtual Artist) 6. Ecrett Music 7. Soundraw 8. Amadeus Code 가트너의 설문조사에 따르면, 을 사용한 적이 있는...",2023.08.09.
202,구글이 만든 인공지능 서비스 챗봇 구글 바드 사용해보기,이미 사용해 보신분도 있겠지만 구글이 지난 구글I/O때 공개한 구글의 인공지능 서비스 챗봇 구글 바드를 이제 누구나 사용할 수 있도록... 즉 인공지능 서비스가 보여주는 답변이 항상 정답은 아닙니다. 그러나 아래와 같이 객관적인 답이 정해진 문제에 대한 답변은 꽤 정확하게...,2023.05.16.
203,"[양평cctv] 전체적인 건물 관리, 인공지능cctv와 함께하세요!","자비스넷은 인공지능 영상보안 전문 업체로 모든 제품군에 인공지능 기술을 적용하고 있습니다. 이 인공지능 기술엔 실시간 객체분류, 침입감지, 투기감지, 군집감지, 주정차감지 기능이 포함되며 상황이 발생할 시 인공지능이 실시간으로 분석, 사용자에게 바로 알림을...",2023.09.15.
204,"‘인공지능 스마트 소화기’로 재난은 막고, 안전한 세상 만들고","[이 주의 조달청 혁신제품] 재난 예방 혁신제품 해외수출 ① 인공지능 스마트 소화기 ‘조달청 혁신제품’을 아시나요? 공공성과 기술성이... ‘인공지능 스마트 소화기’로 재난은 막고, 안전한 세상 만들고 지난달 가슴 아픈 사고가 있었습니다. 유례없던 폭우로 충북 청주...",2023.08.09.
205,"[Specialized Info] 잃어버린 아이들, 인공지능이 찾아낸다면?","인상 착의와 주변 CCTV 활용 한국과학기술연구원(KIST)은 2018년부터 실종 아동 찾기에 인공지능(AI) 기술을 접목하는 연구를 해오고... KTL, 인공지능 발전 위해 힘 보탤 터 이렇듯 인공지능은 우리 생활에 엄청난 변화와 예상 못할 혜택을 줄 수 있습니다. KTL 역시 기술...",2023.07.20.
206,"[이천cctv] 편의점, 인공지능으로 절도 등 사건을 관리하다.","우리 가게가 안전할 수 있는 이유, 인공지능cctv가 지켜주기 때문입니다. 안녕하세요 인공지능 경기cctv 이천cctv 설치 전문 자비스넷입니다. 편의점에선 심심치 않게 작고 큰 절도사건을 마주하게 됩니다. 보통 편의점은 한 명, 많으면 적어도 두 명이 일하는 구조입니다....",2023.09.29.
207,인공지능과 영어회화 챗GPT 영어회화,일단 챗GPT는 인공지능으로 사람이 물어보는 것을 요약을 해서 설명해 주지만 상당히 긴 지문으로 대답을 합니다. 영어회화의 경우 서로... 챗GPT 영어회화 저자 반병현 출판 생능북스 발매 미등록 #영어회과 #반병현 #김연정 #챗GPT영어회화 #영어회화 #생능출판사...,2023.08.06.
208,"[테마주분석] (위성통신,메타버스,ai인공지능,자율주행)...","그래서 오늘 알아보는 위성통신, 메타버스, ai인공지능,자율주행과 연결되어 있는 6G관련주 전망은 많은 도움이 될 거라고 생각합니다. 차세대 미래산업 6G관련주 현재 우주항공 관련주에 관심을 갖고 있습니다. 20년도 우주산업에 들어가는 비용은 약 3,973달러 정도였으며...",2023.09.12.
209,위기감인가 (feat. 네이버 거대인공지능 하이퍼클로바X 출시 예정),"그런데 챗GPT 쇼크로 인하여 빠른 속도로 인공지능이 도입되어 서비스로 상용화되고 발전하고 있지요. 시간의 문제일 뿐 정보성 콘텐츠들은 챗GPT, Bard 등 인공지능 기반의 검색에 흡수되어 갈 수 밖에 없다고 생각됩니다. (아마도 정보는 채팅 화면에 정리되어 출력되고 그...",2023.08.20.
210,"안드로이드어플개발, 인공지능으로 제작비용 절감하는 방법","안드로이드 어플 개발, 제작비용을 절감하고 제작기간을 단축할 수 있는 획기적인 방법 앱 개발을 하는데 인공지능이 코딩을 대신 해준다면 어떨까요? 모든 코딩을 인공지능이 대신 해주기 때문에 코딩 개발자가 필요가 없어집니다. 그래서 코딩을 하기 위해 필요한 개발자의...",2023.06.14.
211,"인공지능으로 무장한 구글의 ‘서치랩스’, 테스트 알렸다","서치랩스의 대표적인 생성형 인공지능(AI) 기능인 SGE(Search Generative Experience)를 사용해볼 수 있다. 단, 구글 랩스(Google Labs)에 가입된 미국의 일부 테스터들에 한정된다. 서치랩스란 5월 초 구글 연례 개발자 콘퍼런스 구글 I/O(Google I/O)에서 발표된 새로운 검색 프로그램이다....",2023.05.26.
212,"[KTL TODAY] KTL,「의료인공지능개발지원센터」개소!","의료기기 인공지능(AI)·빅데이터 분야 연구개발과 중소·스타트업 기업 지원을 위한 인프라를 구축했습니다. KTL은 대구광역시, 유관기관 임직원 및 지역주민 등 약 60여 명이 참석한 가운데 KTL 의료인공지능개발지원센터(대구광역시 서구 소재) 개소식을 개최했다고 6월...",2023.06.21.
213,(마감) 인공지능 화가 0원으로 부려먹기 - 50시간 공들여 만든...,(마감) 인공지능 화가 0원으로 부려먹기 - 50시간 공들여 만든 스테이블 디퓨전 사용법 전자책 PDF 최근 단톡방 이웃분을 통해 재미있는 걸 발견했습니다. 인공지능 화가 스테이블 디퓨젼이 그것입니다. 챗GPT 가 텍스트 기반의 답변을 해주는 AI 이라면 Stable diffusion 은 이미지를...,2023.03.23.
214,인공지능이 그려주는 AI 그림 사이트 인물 사진 같은 AI 이미지...,"SF 영화 속에서나 등장할 것처럼 멀게만 느껴지던 인공지능이 Chat GPT 이후 일상생활에서도 쉽게 만날 수 있게 되었습니다. 정보 검색 이외에... 에디터 페이지로 이동하면 화살표로 표시한 부분에 인공지능 아이콘이 보이며, 상단에는 갤러리 만들기, 모델 사진으로 구분이 되어...",2023.07.03.
215,충북 AI 인공지능[국비무료] ICT 기본과정/시스템 반도체과정...,충북 AI 인공지능[국비무료] ICT 기본과정/시스템 반도체과정 교육생 모집(청주대학교 무료교육) 안녕하세요. 취업비서 인크루트 입니다. 오늘은 청주대학교산학협력단과 함게 하는 충북 AI 인공지능[국비무료] ICT 기본과정/시스템 반도체과정 교육생 모집(청주대학교...,2023.08.01.
216,인공지능이 조종하는 XQ-58A Valkyrie 비행 테스트 성공.,그리고 지난 2023년 7월 25일에는 마침내 사람이 아닌 인공지능의 컨트롤을 받으면서 비행 테스트를 진행했습니다.... 여기에 들어가는 인공지능 시스템은 역시 앞서 소개한 F-16 조종 인공지능 시스템인 VISTA X-62A를 개발한 Autonomous Air...,2023.08.18.
217,"인공지능특허 메타버스특허, 누구나 등록이 가능할까?","AI와 인공지능에 대한 관심이 사회적으로도 빠르게 증가하고 있습니다. 그렇다 보니, 많은 기업이 분야를 가리지 않고 인공지능 개발을 위하여 심혈을 기울이고 있죠. 인간을 대체할 수 있는 수준의 인공지능특허를 등록하게 된다면, 현재의 시장에서 막대한 부가가치를 창출해내는...",2023.09.27.
218,[감사일기] 인공지능과... 소상공인 컨설팅과 인공지능 활용법 교육,#소상공인컨설팅 #인공지능활용법교육 #김영갑교수 안녕하세요. 인공지능 빅데이터 상권분석과 온라인마케팅 전문가 김영갑 교수입니다. 오늘은 2023년 9월 15일 금요일입니다. 저는 오늘 하루도 소상공인 컨설팅과 인공지능 교육을 통해 소상공인의 성공을 돕는 데...,2023.09.15.
219,[ON통정보] 여러분이 생각하는 최고의 인공지능(AI) 기술은?,"그런데 이 인공신경망을 한 번 더 업그레이드한 AI 모델이 나왔어요. 바로 챗GPT인데요. 챗GPT는 대화 전문 인공지능 모델이에요. 챗GPT는 사용자가 대화창에 텍스트를 입력하면 그에 맞춰 대화를 함께 나누는 서비스로, 질문에 대한 답변은 물론 논문 작성, 번역, 노래 작사와 작곡...",2023.04.04.
220,아이디스 주식 주가 전망 인공지능 CCTV 관련주 보안 장비,"영상 보안 현장의 다양한 빅데이터를 학습한 IDLE는 인간의 뉴런과 유사한 인공 신경망이 스 스로 학습하는 딥 러닝(Deep learng) 방식의 인공지능 엔진입니다. 인공지능 영상 보안 IDLA는 사람, 자동차, 자전거 등 빠르게 움직이 는 대상뿐 아니라 주변을 배회하는 모든...",2023.09.19.
221,파파코에서 인공지능으로 투자하는 방법 알아보기,오늘 소개할 투자방법은 인공지능과 관련된 재테크이다. 낯설게 들리실지 모르겠지만 궁금해하실 분들이 있을 것 같아 소개해본다. 파파코 인공지능 기반 자동화 펀딩 플랫폼 인공지능으로 펀딩한다고? 그렇다. 파파코는 학습된 최적의 매매 타이밍들을 모아 더욱 더 최적화된...,2023.05.16.
222,"[도봉구cctv] 빌라의 출입 관리, 400만 화소 인공지능cctv로!","안녕하세요, 인공지능 수도권cctv 도봉구cctv 설치 전문 자비스넷입니다. 세상이 흉흉하다는 말이 나오는 요즘입니다. 제일 안전해야 할... 인공지능cctv 실내의 현관 부근, 즉, 주 출입구에는 문을 열고 들어오는 사람이 누군지 바로 보일 수 있도록 정면 부근에 400만 화소...",2023.09.26.
223,AI(인공지능)와 아이의 미래,"2013년 영화 'Her'에서 주인공 테오도르는 자신의 말에 귀 기울이고 이해해주는 인공지능 '사만다'에게 사랑을 느낀다. AI가 생각을 한다면, 마음이란 걸 가질 수 있는가? AI가 마음 먹은대로 사람의 생각을 바꿀 수 있지 않을까? 대다수 사람들이 생각과 판단을 AI에게...",2023.10.16.
224,AI 인공지능 관련주 어도비 오토데스크 주가 괜찮을까,"인공지능이 다른 많은 산업에 변화를 만들고 있습니다. 디자인 업계에서도 마찬가지인데요, 생성형 AI에 대해 다시한번 짚어보고 관련주인 어도비와 오토데스크 각 기업에 대해 알아본 뒤 각 기업이 인공지능을 어떻게 이용하는지, 그리고 실제 주가나 기업 전망에는 어떤...",2023.09.27.
225,"AICBM (인공지능, 사물인터넷, 클라우드, 빅데이터, 모바일)","첫째로, AI(인공지능)은 학습, 문제해결, 패턴인식 등과 같이 인간 지능과 연결된 인지 문제를 해결하는 것에 주력하는 컴퓨터 시스템을 뜻하는데요. 이세돌과의 바둑 대결에서 승리를 거둔 알파고, 이미지를 자동으로 생성하는 미드저니, 군사용로봇 등이 이에...",2023.06.29.
226,챗gpt 한글 vs 영어 뭘로 써야 할까? 챗gpt 강사 인공지능 강의,뉴미디어캠퍼스에선 챗gpt와 같은 인공지능 프로그램을 활용한 SNS 콘텐츠 제작 강의를 진행하고 있습니다. 자세한 챗gpt 강사 소개와 인공지능 강의 문의는 포스팅 하단 링크를 참고해주세요! 챗gpt의 경우 영어와 한글중 어떤 언어로 질문을 해도 답을 해주기 때문에....,2023.07.19.
227,SKT 인공지능 AI 기술력 엿볼 수 있는 A.(에이닷) 어플 챗T...,"필자가 초등학교를 다니던 시절에는 AI(인공지능)라는 단어는 SF 영화나 과학 책 같은 곳에서만 접했기에 현실적인 느낌이 거의 없었는데, 이제는 일상생활 곳곳에서 적용된 사례들을 쉽게 접할 수 있는 시대가 되었다. 대표적인 예로 자율주행 차량, 개인 비서...",2023.07.21.
228,AI(인공지능) 반짝 테마일까?,"오늘 우선적으로 핀비즈닷컴을 보면 알수있듯이, AI(인공지능) 관련 기업인 구글, 마이크로소프트와 AI반도체 관련주인 엔비디아, AMD에... 보도되어 'AI(인공지능)' 관련 기업에 대한 전반적인 바스켓 매매가 이뤄졌는 점을 본다면, 왜 솔트룩스만 이렇게 약한 모습을 보였을까? 하는...",2023.08.31.
229,인공지능 Ai 반도체 SOC 관련 주 퀄리타스반도체 공모주 IPO...,"이번에 공모주 상장하는 퀄리타스반도체는 인공지능 Ai에 필요한 반도체 설계자산(IP) 기업인데요! 올해 기관투자자 참여율 중 최대를 기록한 퀄리타스반도체의 공모주 IPO 청약 정보와 함께 균등, 비례 정도까지 알아보도록 하겠습니다. AI, SOC 반도체 관련 주...",2023.10.18.
230,[KISA] 인공지능 시대의 데이터와 보안 정책 세미나 개최,"KISA는 지난 6월 9일(금) 한국데이터법정책학회, 조선대학교와 함께 '인공지능 시대의 데이터와 보안 정책 세미나'를 개최했습니다 이번 세미나에서는 국회 입법조사처의 정준화 입법조사관이 '인공지능 생성모델의 법적 문제', 경찰대 정혜련 교수가 ' 고도화를 위한...",2023.06.15.
231,인공지능 AI 무선 블루투스 스피커 갤럭시 홈 미니,"보통 시중에 인공지능 AI 스피커라고 하면 구글 홈 미니나 네스트, 네이버 클로바, 혹은 통신사의 제품들이 떠오르는데요. 삼성전자 갤럭시에서도 인공지능 AI 스피커가 출시된 것을 알고 계시나요? 바로 2020년 출시된 갤럭시 홈 미니입니다. 갤럭시 홈 미니는 패브릭...",2023.08.20.
