,title,text,date
232,국내 챗GPT 인공지능 AI 관련주 - 네이버 카카오 LG전자...,"국내 인공지능 관련주와 AI모델 개발 현황 3. 4개 기업의 주가와 전망 글. @피어나라뚜두뚜두의 Behappy 오늘은 챗GPT 플러그인 기술에 대한 소개와 함께 국내 인공지능 AI 관련주에 대해 알아보려 한다. 1. 챗GPT 플러그인이란? © geojango_maps, 출처 Unsplash 「7월에 치앙마이 한...",2023.05.17.
233,"은행지점폐쇄, 인공지능으로 대체되는 직업 10가지",일공지능의 발전은 이처럼 기존의 많은 일자리를 대체하고 있습니다. 인공지능이 급격하게 발전하는 지금! 우리가 해야할 것은 인공지능을 효과적으로 이용하는 것입니다. 2023년 해외 전문가들은 인공지능이 대체할 가능성이 있는 직업군 10가지를 소개하였습니다. 기술직...,2023.05.09.
234,"광고 전화 차단과 조용한 채팅방, 인공지능 적용 프로그램' 등","채팅방, 인공지능 적용 프로그램 등 교육에 참석했어요. 토요포럼 509회 - 이경종 대표님의 '챗GPT 비교 및 활용사례'와 전종현 교수님의 '겔러리, 광고 전화 차단과 조용한 채팅방, 인공지능 적용 프로그램 등 서울소셜리딩그룹 토요포럼 509회 시간 : 9시 30분~12시 장소...",2023.08.05.
235,Chatdoc - pdf 요약 인공지능 서비스,♣ Chatdoc - pdf 요약 인공지능 서비스 1. chatdoc를 검색하고 사이트에 접속합니다. 2. Get started를 클릭합니다. 3. Sign in을 클릭하여 로그인합니다. Sign in with Google을 클릭하여 구글 아이디로 가입하고 로그인하면 빠릅니다. 4. 무료로 이용할 때는 최대 20페이지까지 이용...,2023.10.20.
236,"미래학자, 미래의 학교는 인공지능 교사가 수업을 진행한다고,",그녀는 2050년이면 학생들이 인간 교사 없이 AI(인공지능) 교사로부터 직접 지식을 뇌에 다운로드하고 DNA에 맞는 수업을 받을 것이라고... 아이들은 인공지능 시스템을 다루는 법을 배우게 될 것이며 이것이 가장 중요한 기술이 될 것입니다. “제 생각에 가장 중요한 기술은 AI...,2023.09.20.
237,[칼럼] 윤리적인 인공지능을 위해 필요한 것은?,"인공지능에게 어떠한 주제에 대한 질문을 했을 때, 그에 대해 더 많이 아는 사람은 인공지능의 답변에 대해 비판적으로 사고하기에 유리하지만, 그렇지 않은 사람은 큰 의심 없이 수용할 가능성이 높다. 인공지능에 대한 의존도가 높아지는 만큼, 이 갖추어야할 ‘윤리성’...",2023.03.13.
238,"인공지능 기반 화성 민원 상담 소통봇, 화성 소통봇 스마트하고...","챗GPT는 포털 검색보다 더 길고 자세한 답변을 달아주는 인공지능 대화형 검색 로봇이라고 할 수 있습니다. 미국의 오픈 AI 사가... 제가 서두에 챗GPT를 얘기한 것은 경기도 화성시가 인공지능을 기반으로 365일 24시간 언제, 어디서나 민원상담이 가능한 챗봇 서비스를 개발했는데요....",2023.08.14.
239,인공지능 관련주 AI 코지티피 2.0 기대 카카오 실적 주가 전망,"오늘은 인공지능 관련주 카카오의 기업, 실적, 주가 전망에 관하여 알아본다. 카카오 1. 기업분석 2. 기업 실적 3. 주가 전망 기업분석... 10월 인공지능 AI '코지피티 2.0' 출시로 카카오의 주가가 반등을 할지 주목되고 있다. 카카오그룹에서 반년 동안 개미들이 15만 명이...",2023.09.01.
240,'몰입형 SW-AI교육 체험활동 캠프' 인공지능 프로그래밍과 챗봇...,"'몰입형 SW-AI교육 체험활동 캠프' 인공지능 프로그래밍과 챗봇 프로그래밍을 직접 실습 대구 뉴스/교육 by 요즘대구 2023. 8. 7. 13:50 공감... 인공지능에 대한 학생들의 흥미와 이해도를 높이고, 미래사회의 핵심 역량인 리터러시 및 컴퓨팅 사고력을 기를 수 있도록 돕기...",2023.08.07.
241,파이썬 머신러닝의 구조 인공지능 입문 책추천,"구조 인공지능 입문 책추천 파이썬 머신러닝 공부를 시작하신다면, 파이썬은 정말 다방면에서 활용되는 범용 프로그래밍 언어 같아요. 요즘 파이썬이 가장 많이 활용되는 분야 중 데이터과학 분야는 그동안 R 통계 패키지가 지배적이었거든요. 파이썬에 관련...",2023.10.04.
242,인도네시아 AI(인공지능) 시장 트렌드,"‘2020-2045 인공지능 국가전략(Strategi Nasional Kecerdasan Artifisial Indonesia 2020-2045)’을 발표했다. 이를 통해 인도네시아 기업의 생산성 향상, 인적 자원 활용, 다양한 분야의 혁신 촉진을 목표로 세웠다. 그리고 인공지능 국가전략을 달성하기 위해 우선적으로 AI를...",2023.08.18.
243,[Clipdrop] 인공지능으로 이미지 여백 채워 넣기,"UNCROP은 CROP처름 원본 이미지의 일부를 잘라내는 것과 달리, 반대로 원본 이미지의 상하좌우 여백을 추가해서 인공지능으로 채워 넣을... ▲ 제가 사용할 첫 번째 원본 이미지는 Clipdrop에서 인공지능으로 생성했습니다. 이미지를 추가할 때 드래그 앤 드롭 방식으로 가져다...",2023.08.04.
244,지금 인공지능 관련주 사도 될까? 미국 인공지능 관련주식...,얼리어답터 리뷰/IT정보 지금 인공지능 관련주 사도 될까? 미국 인공지능 관련주식 무엇이 있나 by 엔돌슨 2023. 5. 20. 미국 인공지능 관련주식 사도 될까? 인공지능 AI 캄브리아기처럼 엄청난 생성형 AI가 출시되고 있습니다. 그래서 미래의 투자로 관련주에...,2023.05.20.
245,있는 인공지능 클라이언트 서비스(The Artificial Client)...,덴츠 크리에이티브 클라이언트 입장에서 크리에이티브를 피드백 받을 수 있는 인공지능 클라이언트 서비스(The Artificial Client) 테스트 New Tech/AI(인공지능) by 마켓캐스트 2023. 9. 19. 08:30 공감 덴츠 크리에이티브는 가상의 클라이언트...,2023.09.19.
246,인공지능(AI)를 활용한 현대화 프로젝트,"인공지능(AI)를 활용한 현대화 프로젝트 -Todd Walden , Aaron Crews #스마트팩토리 , 현대화 프로젝트는 여전히 딜레마입니다. 많은 플랜트가... Aaron Crews는 Efficient Plant의 기사에서, “오늘날의 최신 디지털 도구는 (AI)을 활용하여 엔지니어링에 소요되는 시간을 단축하고...",2023.08.10.
247,[마포cctv] 매머드익스프레스 상수역점 인공지능cctv 설치 사례,매장의 인공지능cctv 설치 및 관리를 도와드리고 있습니다. 수도권cctv 이번에 설치를 진행한 매장은 신규 오픈 예정인 매머드커피익스프레스 상수역점입니다. 손님 분들을 맞이하기 위한 단장이 한창인 이곳에 초기 보안부터 확실하게 쌓아가기 위해서 cctv를...,2023.09.25.
248,"분당서울대병원, 인공지능 기반 X-ray 분석으로 수면무호흡증...",idx=58384 인공지능 기반 X-ray 분석으로 수면무호흡증 진단 딥러닝 알고리즘을 활용한 두경부 X-ray 영상. 붉은색이 진할수록 수면무호흡증을 나타낸다. 분당서울대병원 제공두경부 엑스레이(X-ray) 영상을 분석해 수면무호흡증을 진단하는 인공지능 모델 www.dongascience.com...,2023.09.26.
249,"인공지능 데이터라벨링 과정, 크라우드웍스 데이터라벨러가...","인공지능 데이터라벨링 과정, 크라우드웍스 데이터라벨러가 되기 위한 AIDE 정보 안녕하세요. 사진&IT 크리에이터 자유분방입니다. 요즘은 뉴스를 보다 보면 챗GPT, 메타버스, VR, AR, 인공지능, 로봇, AI 등에 대한 이야기가 계속해서 흘러나오고 있습니다. 몇 년 전만 하더라도...",2023.07.15.
250,[광주cctv] 종교시설의 외·내부 관리를 인공지능cctv로!,광주cctv 설치 사례 종교시설cctv 설치 사례 설치상담 : 1666-0068 (주)자비스넷은 kt skylife HCN과 인공지능 영상장비 ODM 납품 및 서비스 제공에 관한 B2B 협약을 맺은 공식파트너사입니다. #경기cctv #광주cctv #cctv설치 #cctv #교회cctv #cctv #cctv설치업체,2023.09.28.
251,인공지능 주가는 현재 거품인가(ft. 닷컴 버블과 비교),"인공지능을 둘러싼 과대 광고로 인해 주식 시장에 거품이 있다고 생각하십니까? 다시 한 번 생각해 보세요! 라고 펀드스트랫의 톰... 인공지능이 거품이 되려 한다면, 1999년 거품은 10배 이상 증가한다는 것을 알아야 한다고 생각합니다.""라고 이씨는 말했습니다. Lee가...",2023.07.29.
252,인공지능 장점 및 단점 3개씩 알아보자,인공지능(AI)는 우리 일상생활을 많이 윤택하게 해주고 있습니다. 그리고 인공지능은 미래 산업의 핵심 먹거리로 꼽히고 있으며 4차 산업혁명에서 가장 중요한 분야로 꼽히고 있죠. 이런 인공지능 장점은 매우 다양하지만 그와 반대로 단점도 분명히 존재합니다. 오늘은...,2023.10.18.
253,"인터넷 인공지능 관련주 네이버, 카카오 정리","세계적으로 인공지능 챗봇의 열풍으로 인공지능AI, 인터넷플랫폼 관련 주식들이 상승한 모습을 볼 수 있다. 오픈AI에서 출시한 Chat GPT를 시작으로, 글로벌 기업들인 구글, 마이크로소프트, 그리고 한국의 네이버와 카카오 등이 관련 서비스의 개발 및 투자를...",2023.04.18.
254,개인 딥러닝 인공지능 머신 연습용 조립컴퓨터 고사양 조립PC,개인 딥러닝 인공지능 머신 연습용 조립컴퓨터 고사양 조립PC 안녕하세요^^ 에이제이 인사드립니다. 오늘은 고사양 조립컴퓨터를 소개... #고사양컴퓨터 #최고사양컴퓨터 #딥러닝개인컴퓨터 #인공지능프로그램개발컴퓨터 #조립컴퓨터 #용산컴퓨터제작 #조립PC견적...,2023.10.12.
255,〈신기한 인공지능 코딩 대모험〉 용어 퀴즈,"코딩 전문가 노훈 작가님이 초등학생 눈높이에 맞춰 쓴 코딩 동화 《신기한 인공지능 코딩 대모험》 ""인공지능과 코딩"" 왠지 어려울 것 같지만, 우리가 실생활에서 친숙하게 사용하고 있어요. Siri같은 비서 앱, 수많은 데이터로 최적의 답변을 해주는 ChatGPT, 관심있는...",2023.09.18.
256,"’27년까지 인공지능(AI) 12,800명, 클라우드 18,800명...","* 1차(7.20./인공지능, 빅데이터), 2차(7.27./클라우드, 사이버 보안), 3차(8.17./이차전지, 첨단소재), 4차(8.31./나노, 3D프린팅, 차세대디스플레이) 이날 포럼에 앞서 고용부와 한국직업능력연구원은 인공지능(AI) 등 4개 주요 신기술분야에 대한 ’27년까지의 인력수급 전망 결과를...",2023.08.31.
257,[인공지능 교육] 'AI 기술 창업 트렌드 분석' 강의 진행,"인공지능산업융합산업단(광주광역시 소재)에서 진행하는 AI 창업교육 1차에서 '인공지능 기술 창업 트렌드 분석'에 관한 주제로 강의했습니다. 인공지능산업융합사업단에서 개최하는 AI 창업 교육으로 3일 과정 중 첫째 날 가장 먼저 강의를 진행했습니다. 이번 강의는 서울, 경기...",2023.05.31.
258,AI 인공지능 관련주 챗GPT 바드 - 춤을 추되 문 근처에서 춤을...,개인적으로 인터넷이 불러온 3차 산업혁명 이후 4차의 주인공이 인공지능이 되지 않을까 싶은데요. 기존에 메타버스니 블록체인이니 같은 얘기가 많았지만 진정한 기술혁명의 주인공은 AI 가 될 것으로 생각합니다. 문제는 개인이 투자하는 이유는 의 발달을 보고자...,2023.02.15.
259,인공지능 드론을 테스트하는 AUKUS 연합,"및 인공지능 기술을 실제 전장에서 사용하기 위한 테스트를 진행했습니다. 이미 인공지능은 현대전에서 활약하고 있지만, 대부분의 무인기와 무인 차량은 사람이 직접 조종해야 하는 형태입니다. 하지만 최근 AI 기술의 급속한 발전으로 사람은...",2023.06.06.
260,대구시 인공지능(AI) 민원상담사 “뚜봇아~ 치킨 줄래?”...,대구시 인공지능(AI) 민원상담사 “뚜봇아~ 치킨 줄래?” 이벤트를 대구 북구에서 알려드립니다! 대구의 대표 축제인 대구치맥페스티벌... 자세한 내용은 아래의 게시물을 참고해주세요❗ 대구시 인공지능(AI) 민원상담사 “뚜봇아~ 치킨 줄래?”이벤트 ✅이벤트 기간 8. 9.(수)...,2023.08.09.
261,측정해서 인공지능인 클로바(Clova)에게 음성으로 읽어달라고...,측정하고 인공지능인 클로바(Clova)에게 음성으로 측정값을 읽어달라고 해볼거에요! 엔트리(entry)에 아두이노를 연결하기 위해서는... 엔트리 캐릭터를 선택하면 지금 측정중인 이산화탄소농도를 인공지능인 클로바(clova)에게 음성으로 읽어달라고 할거에요!...,2023.10.14.
262,인공지능으로 특허 심사 더 빠르고 정확하게,"- 특허청, 「인공지능(AI) 기술을 활용한 특허행정 혁신 로드맵」발표 - 특허청(청장 이인실)은 ’23년을 인공지능(AI) 등 신기술을 활용한 특허행정 디지털 혁신의 원년으로 삼고, 2월 2일(목), 「인공지능(AI) 기술을 활용한 특허행정 혁신 로드맵(‘23~’27)」(이하, ‘AI 활용...",2023.02.02.
263,Adobe AI 포토샵 일러스트 인공지능 컨텐츠 CR 로고 추가,"Adobe AI 포토샵 일러스트 인공지능 컨텐츠 CR 로고 추가 2023년 10월 10일(현지시간), 세계적으로 유명한 소프트웨어 기업인 어도비(Adobe)가... AI 인공지능 컨텐츠 CR 기호의 활용과 기능 CR 기호는 이미지, 비디오, PDF 콘텐츠의 우측 상단에 표시되며, 물방울 모양에 CR이라 적힌...",2023.10.13.
264,"인공지능이 발전하면 사라질 직업, 생겨날 직업이 무엇이 있을까?",특히 인공지능이 개발이 되면서 미래에는 없어질 직업들이 있다고 이야기하고 계실텐데요. 인공지능의 발전은 여러 산업과 직업에 영향을 미칠 수 있어 미래를 대비하기 위해서 미리 알아보고 준비하시는 것이 필요하답니다. 일부 직업은 자동화나 기술의 도입으로 인해...,2023.05.25.
265,대구경동초 '한여름 밤의 디지털 플리마켓'···인공지능(AI)과...,"대구경동초 '한여름 밤의 디지털 플리마켓'···인공지능(AI)과 독서몰입교육 연계 대구 뉴스/교육 by 요즘대구 2023. 7. 21. 12:36 공감 대구시교육청 지정 인공지능(AI)교육 선도학교를 운영하고 있는 대구경동초등학교는 2023년 7월 20일(목) 18시 30분, 학교 운동장에서 학생 및...",2023.07.21.
266,부모교육 [HELLO AI! 인공지능시대 자녀교육과 정신건강],인공지능시대 자녀교육과 정신건강] 참여자를 모집합니다! (งᐛ)ว (งᐖ )ว 인공지능시대에 살아가며 자녀를 어떤 인재로 키울 수 있을지에 대한 해답과 우리 아이들의 마음을 들여다보는 시간! ( •͈ᴗ-)ᓂ-ෆ 참여하신 분들 중 추첨을 통해 총 10분께 명지병원...,2023.08.17.
267,[찾아라! 최초인물] 최초의 인공지능 로봇 예술가 '에이다',"최초의 인공지능 로봇 예술가 에이다 시작해 볼까요? 시, 조각, 회화를 넘나들며 작품활동을 활발하게 하고있는 영국의 한 예술가... 오늘은 최초로 전시회를 열고 직접 창작한 시까지 낭송하는 인공지능 아티스트 에이다를 만나볼까요? 에이다는 2019년 영국에서 프로그래머...",2023.05.11.
268,"인공지능학과, 어떻게 준비하면 좋을까?",인공지능 기술 (디지털 휴먼 등의 인간-공지능 간 자연스러운 감성의 교류를 제공할 수 있는 첨단 기술에 대한 이해 능력) 2. 확장/혼합현실 기술 (기술 사용자의 몰입감 및 현장감을 최대한 극대화할 수 있는 첨단 환경에 대한 이해 능력) 3. 실감 콘텐츠 기획 (최신 기술을 바탕으로...,2023.09.05.
269,연결하고 인공지능(AI)인 CLOVA에게 온도와 습도값을...,습도값을 인공지능(AI)인 Clova에게 음성으로 읽어달라고 해볼거에요! 먼저 아두이노와 센서를 연결하는 작업을 해야해요! 녹칸다... 이제 인공지능(AI)인 clova에게 측정한 온도와 습도값을 음성으로 읽어달라고 해볼거에요! 엔트리 캐릭터를 클릭하면 읽어주도록...,2023.10.07.
270,구글 바드 사용법 구글 인공지능(Bard) AI 챗봇!,"구글에서도 챗GPT에 맞서기 위해서 인공지능 챗봇을 선보였는데요. 그래서 오늘은 구글 인공지능 챗봇, 구글 바드(Bard) 사용법에 대해서 알아보겠습니다. 구글 바드 사용조건 구글 바드는 챗GPT와 다르게 조건이 하나가 있는데 바로 만 18세 이상인 구글 계정에서만 사용이...",2023.06.13.
271,달서중 '2023 인공지능(AI) 캠프'···AI·VR·로봇·드론...,"달서중 '2023 인공지능(AI) 캠프'···AI·VR·로봇·드론 교육 프로그램 대구 뉴스/교육 by 요즘대구 2023. 7. 25. 15:15 2 달서중 '2023 인공지능(AI) 캠프' 대구광역시교육청 선정 ‘SW-AI교육 중점 학교’인 달서중학교는 2023년 7월 22일(토), 작년에 이어 2회째 달성군 초등학생...",2023.07.25.
272,전문 인공지능 챗봇 열풍!... (feat. 환경 관련 인공지능 사례),최근 세계적으로 주목받는 챗GPT와 같이 인공지능 기술은 일상 속 다양한 부분에서 도움을 주고 있는데요. 심지어 환경 문제에 대응하는 인공지능 기술 역시 개발되고 있는 상황입니다! 오늘은 푸루와 함께 세계를 흔든 챗GPT 사용법부터 국내 환경 관련 기술...,2023.02.23.
273,"누구나 쉽게 배우는 소프트웨어와 인공지능, 2023 온라인...","코딩을 잘 모르는 이부터 코딩에 능수능란한 이들까지 새롭고 다양한 프로그램으로 소프트웨어, 인공지능과 친해질 수 있게 해주는... 어린이들이 사랑하는 친근한 캐릭터인 펭수나 엘사, 전 세계인이 사랑하는 BTS 등 특별한 캐릭터들이 프로그램의 주인공이 된 것이 반갑게...",2023.06.22.
274,"주말의 챗GPT, 인공지능에 의한 정보유출 우려 뉴스들 (ft....","여튼 챗GPT 같은 인공지능이 코딩도 할 줄 안다는데 이것이 악용되면 해킹, 정보유출 등의 우려가 앞으로 더 커질 것임은 당연히 걱정이... 그러니 이런 기사 뒤에 '인공지능에 의한 해킹, 보안 우려에 대한 연구투자의 필요성'에 대한 것이 깔릴 수 밖에 없을 겁니다. 이에 대해서...",2023.04.02.
275,인공지능이 주식시장을 구할 수 있을까?,"챗GPT의 갑작스러운 인기로 촉발된 인공지능에 대한 관심의 급증은 수조 달러의 주식시장 가치를 창출했습니다. 엔비디아는 현재 인공지능 시장에서 선두로 175% 이상 급등하여 1조 달러 클럽에 가입했으며, 메타도 119% 상승했습니다. 알파벳과 마이크로소프트와 같은 빅 테크...",2023.06.14.
276,인공지능의 논란과 기회 3-Panic & Opportunities of AI,나머지 나라들이 챗GPT에 재미 삼아 프롬프트(질문/명령)를 입력하는 동안 선점한 국가는 인공 슈퍼 지능을 얻게 된다. 핵무기 사용을 저지하려면 핵무기가 필요하다. 인공지능도 마찬가지다. 지구상 거의 모든 국가가 인공지능 개발이나 군비경쟁에 서로 협력하는 이유다....,2023.06.07.
277,인공지능 스피커 기가지니LTE2 알아보기,"집안에 여러가지 가전을 제어할 수 있는 상태가 되면서 어느덧 인공지능 스피커에 대해 관심이 생기고 있습니다. 특히 저같은... 기가지니 LTE 2는 KT에서 출시한 인공지능 스피커 지니 라인업 제품 중 하나이며, 지니 2세대 제품입니다. 아무래도 KT 유저들을 타겟으로...",2023.09.13.
278,"구글 지메일, 인공지능으로 초안 ‘뚝딱’ 만든다",구글 I/O 2023 (출처: 더모바일인디안(TheMobileIndian)) 구글이 발표한 새로운 생성형 인공지능(AI) 기능으로 지메일(Gmail) 작업이 더욱 빠르고... 단순히 사용자가 원하는 프롬프트를 입력하면 인공지능이 관련 지식을 기반으로 문장을 자동 완성시켜준다. 어조를 변경할 수 있는...,2023.05.12.
279,챗GPT 사용법 인공지능 글쓰기부터 마케팅활용하는 방법 강의,"챗GPT 사용법 인공지능 글쓰기부터 마케팅활용까지 줌 특강 강의 챗GPT를 활용해서 할 수 있는 작업은 정말 다양합니다. 블로그 글쓰기... 지난번 진행한 챗GPT 사용법 강의에서는 ""인공지능과 함께 글쓰기부터 마케팅까지"" 주제로 활용에 대한 강의를 진행하였습니다....",2023.07.01.
280,데이터안심구역에서 인공지능 빅데이터 분석과 파이썬 무료...,"같은 인공지능에 대한 관심과 열기가 대단합니다. 기업이나 기관, 업체에서 생산된 단일 DATA들을 다양하게 연계하여 분석할 때 실생활에... 빅데이터와 인공지능 등에 관심이 많고 분석 및 활용과 관련된 직무에 대해 알아볼 수 있는 진로 체험도 있습니다. 해당 커리큘럼은 매주...",2023.05.31.
281,"[사람나래] 인공지능으로 공무원 복무 관리, 일하는 방식...","인사혁신처는 '인공지능 기반 지능형(스마트) 복무 관리 시스템'을 내년부터 시범 운영하고 오는 2025년까지 전 중앙행정기관이 본격 시행할 수 있도록 시스템을 구축한다고 밝혔는데요. 추진 배경을 정리하면 아래와 같습니다. 첫째, 전 중앙행정기관 공통 시스템을 통한 유연한...",2023.06.20.
282,"MZ 세대의 자기 계발, 인공지능 시대에 자아 이미지부터 바꿔라.","아날로그 세상에서 디지털 세상으로 바뀌고, 인공지능으로 인하여 기존의 일자리에서 새로운 일자리를 찾아야 하는 변화의 시점에서... MZ 세대 모두가 자아 이미지를 바꾸어 인공지능 시대에 주역이 되기를 바랍니다. 사랑합니다. 감사합니다. 모바 비즈 올림",2023.06.24.
283,인공지능의 논란과 기회 4-Panic & Opportunities of AI,"우리 스스로 인공지능을 능가하지 못할 것이라고 말하는 것이 안전하다. 오픈AI 창업자 '샘 알트만'은 ""오픈AI가 어떻게 큰 사업이 될지는 모르겠다. 슈퍼 지능을 구축한 다음, 그다음은 어떻게 할 것인지 거꾸로 물어보려고 한다""고 언급했다. 실제로는 꽤 사실적인 표현이다....",2023.06.08.
284,"인공지능 전문가 데이터라벨링, 알바와 전업으로 가능한 일","본인도 무엇이 좋을까 고민하던 찰나 인공지능 전문가 데이터라벨링에 대한 이야기를 듣게 되었다. 미래 산업이라고 부를 정도로 많은 사람이 관심을 가지는 직종으로, 데이터라벨링은 알바와 전업으로 도전하는 추세다. 데이터라벨링은 기계 학습 및 모델을 훈련하기...",2023.07.25.
285,인공지능으로 운전 습관... 혁신제품 ‘인공지능 기반 교통사고...,"인공지능(AI) 기술을 기반으로 도로 위험도 관찰, 범죄 차량 추적, 도로파손 여부, 고령 운전자 인지능력 등 빅데이터를 모으고, 운전자를 실시간으로 관리하고 파악해 안전운전을 하도록 교육합니다. 덕분에 많은 운전자가 자신의 운전 습관을 객관적으로 인지하고 개선해...",2023.08.17.
286,네이버 하이퍼클로바X - 국내 초거대 AI 인공지능 모델 24일...,"챗 GPT의 '네이버' 버전이라고 생각하시면 된답니다.ㅎㅎ) 종종 초거대 인공지능(AI) 언어모델 관련 소식을 전하긴 했지만, 한국 기업에 대한 소식을 전하는 건 처음인 것 같은데요. ㅎㅎ (사실상 현재로서 거의 유일한 K-AI거대언어모델!ㅋㅋ) 아직 출시된 건 아니고요. 오는 8월...",2023.08.22.
287,"AI관련주, 인공지능 챗GPT 그리고 관련주들","정의한다 지능을 갖고 있는 컴퓨터 시스템 정도로 기억해두자 AI가 무섭다고 느껴졌던 영화 '아이로봇' AI가 산업에 미치는 영향 인공지능의 역사는 1700년 대 사람이 로봇처럼 체스를 두던 체스기계의 등장을 시작으로 체스 세계 챔피언과 맞붙은 IBM의 ‘딥 블루’, 이세돌...",2023.02.27.
288,2023 온라인 코딩파티 시즌2 소프트웨어 인공지능 교육 6주간...,"과학기술정보통신부와 교육부, 한국과학창의재단은 누구나 쉽고 재미있게 소프트웨어와 인공지능 교육을 체험할 수 있는 '2023 온라인... 소프트웨어와 인공지능의 원리를 쉽고 재미있게 게임처럼 체험할 수 있도록 매년 새롭고 다양한 프로그램으로 구성하여 진행되고 있으며...",2023.10.09.
289,2023년 지질자원 데이터 활용 및 인공지능 경진대회,2023년 지질자원 데이터 활용 및 인공지능 경진대회 소식 입니다. 참가자격은 지질자원 연구데이터 활용·아이디어 제시 및 AI 모형 개발 등에 관심 있는 국민 누구나 입니다. * 2023년 지질자원 데이터 활용 및 인공지능 경진대회 : http://www.geodata-con.kr/2023/index.php 2023년...,2023.06.10.
